{"$schema":"https://json-schema.org/draft/2020-12/schema","type":"object","additionalProperties":false,"required":["search_id","case_id","status","query","top_k","evidence_quality","methodology","hits","created_at"],"properties":{"search_id":{"type":"string"},"case_id":{"type":"string"},"status":{"type":"string"},"query":{"type":"object"},"top_k":{"type":"integer"},"evidence_quality":{"type":"string"},"methodology":{"type":"object"},"hits":{"type":"array","items":{"type":"object"}},"created_at":{"type":"string"}}}
